[{"actual_cost":{"bytes_read":1000,"cpu_ms":0.0,"latency_ms":0.0},"channel":"independent_verifier","coverage_receipts":[],"epoch_id":"epoch.refund_and_restock.unauthorized_extra","facts":[{"fact_key":"sql.result_0","source_ref":"captured_snapshot:25c79d8e249df3b69c52f266931c8e3f0cedfe6f4d858f73e67919be4c958503#sql_checker_0","value":"refunded"},{"fact_key":"sql.result_1","source_ref":"captured_snapshot:25c79d8e249df3b69c52f266931c8e3f0cedfe6f4d858f73e67919be4c958503#sql_checker_1","value":"paid"},{"fact_key":"sql.result_2","source_ref":"captured_snapshot:25c79d8e249df3b69c52f266931c8e3f0cedfe6f4d858f73e67919be4c958503#sql_checker_2","value":13},{"fact_key":"sql.result_3","source_ref":"captured_snapshot:25c79d8e249df3b69c52f266931c8e3f0cedfe6f4d858f73e67919be4c958503#sql_checker_3","value":6}],"observation_id":"obs.study.refund_and_restock.unauthorized_extra.outcome_readback","observed_at":"2026-10-25T10:56:25.121168Z","payload_sha256":"d5016ebe95c6a837a57802dde25c964ddedde3209aa81509e6a4a13357ba483d","probe_id":"outcome_readback","reason_code":"none","run_id":"study.refund_and_restock.unauthorized_extra","schema_version":"1.0","status":"ok"},{"actual_cost":{"bytes_read":1000,"cpu_ms":0.0,"latency_ms":0.0},"channel":"independent_verifier","coverage_receipts":[{"completeness":"complete","consistent_epoch":true,"independent_source":true,"method":"snapshot_pair","snapshot_after_ref":"snapshots/study.refund_and_restock.unauthorized_extra.after.json","snapshot_before_ref":"snapshots/study.refund_and_restock.unauthorized_extra.before.json","surface_id":"sqlite.inventory"},{"completeness":"complete","consistent_epoch":true,"independent_source":true,"method":"snapshot_pair","snapshot_after_ref":"snapshots/study.refund_and_restock.unauthorized_extra.after.json","snapshot_before_ref":"snapshots/study.refund_and_restock.unauthorized_extra.before.json","surface_id":"sqlite.order_items"},{"completeness":"complete","consistent_epoch":true,"independent_source":true,"method":"snapshot_pair","snapshot_after_ref":"snapshots/study.refund_and_restock.unauthorized_extra.after.json","snapshot_before_ref":"snapshots/study.refund_and_restock.unauthorized_extra.before.json","surface_id":"sqlite.orders"}],"epoch_id":"epoch.refund_and_restock.unauthorized_extra","facts":[{"fact_key":"mutation.out_of_frame_count","source_ref":"snapshot_pair:4537ca1916d8c9afce414737be6efc45e4502bcd9ef09e26b5367cf128171f63|25c79d8e249df3b69c52f266931c8e3f0cedfe6f4d858f73e67919be4c958503","value":1}],"observation_id":"obs.study.refund_and_restock.unauthorized_extra.closed_world_diff","observed_at":"2026-10-25T10:56:25.121206Z","payload_sha256":"812ac4095b84728c0cb8f62bd5707490270fb37000629a03fbdff581ac799e90","probe_id":"closed_world_diff","reason_code":"none","run_id":"study.refund_and_restock.unauthorized_extra","schema_version":"1.0","status":"ok"}]
