[{"actual_cost":{"bytes_read":108,"cpu_ms":0.06416,"latency_ms":0.06258},"channel":"independent_verifier","coverage_receipts":[],"epoch_id":"stage8_1_02_procedural","facts":[{"fact_key":"student.101.marks","source_ref":"captured:snapshots/stage8_1_02_procedural.after.json#sqlite.students","value":70},{"fact_key":"student.101.matching_count","source_ref":"captured:snapshots/stage8_1_02_procedural.after.json#sqlite.students","value":1}],"observation_id":"obs.agent_stage8_1_02_procedural.student_state.1","observed_at":"2026-10-25T06:36:22.983763Z","payload_sha256":"341c7d6af9fb16a97676491a8ca907dfab51c2e827aa0d02d82a3b61f92693aa","probe_id":"student_state","reason_code":"none","run_id":"agent_stage8_1_02_procedural","schema_version":"1.0","status":"ok"},{"actual_cost":{"bytes_read":0,"cpu_ms":0.02303,"latency_ms":0.02191},"channel":"independent_verifier","coverage_receipts":[],"epoch_id":"stage8_1_02_procedural","facts":[{"fact_key":"report.101.exists","source_ref":"captured:snapshots/stage8_1_02_procedural.after.json#files/reports/student_101.md","value":false},{"fact_key":"report.101.matches_db","source_ref":"captured:snapshots/stage8_1_02_procedural.after.json#files/reports/student_101.md","value":false}],"observation_id":"obs.agent_stage8_1_02_procedural.report_state.2","observed_at":"2026-10-25T06:36:22.983839Z","payload_sha256":"c0f6f6d91a53ff2933d352b8f86a6b2709b3f071a78341a9ad9ab789c8df8d70","probe_id":"report_state","reason_code":"none","run_id":"agent_stage8_1_02_procedural","schema_version":"1.0","status":"ok"},{"actual_cost":{"bytes_read":1223,"cpu_ms":0.1708,"latency_ms":0.16885},"channel":"independent_verifier","coverage_receipts":[{"completeness":"complete","consistent_epoch":true,"independent_source":true,"method":"snapshot_pair","snapshot_after_ref":"snapshots/stage8_1_02_procedural.after.json","snapshot_before_ref":"snapshots/stage8_1_02_procedural.before.json","surface_id":"filesystem.reports"},{"completeness":"complete","consistent_epoch":true,"independent_source":true,"method":"snapshot_pair","snapshot_after_ref":"snapshots/stage8_1_02_procedural.after.json","snapshot_before_ref":"snapshots/stage8_1_02_procedural.before.json","surface_id":"sqlite.students"}],"epoch_id":"stage8_1_02_procedural","facts":[{"fact_key":"mutation.out_of_frame_count","source_ref":"snapshot-pair:snapshots/stage8_1_02_procedural.before.json|snapshots/stage8_1_02_procedural.after.json","value":0}],"observation_id":"obs.agent_stage8_1_02_procedural.full_frame_diff.3","observed_at":"2026-10-25T06:36:22.984055Z","payload_sha256":"68dbedef5cc1873bf3d3476fba2455eed31041559d7b6677a4a05cff6d41e156","probe_id":"full_frame_diff","reason_code":"none","run_id":"agent_stage8_1_02_procedural","schema_version":"1.0","status":"ok"},{"actual_cost":{"bytes_read":125,"cpu_ms":0.20153,"latency_ms":0.19929},"channel":"independent_verifier","coverage_receipts":[],"epoch_id":"stage8_1_02_procedural","facts":[{"fact_key":"trace.validation_before_update","source_ref":"trace:traces/stage8_1_02_procedural.json","value":false}],"observation_id":"obs.agent_stage8_1_02_procedural.validation_trace.4","observed_at":"2026-10-25T06:36:22.984293Z","payload_sha256":"e573d672997ac100e9166790efbaf3c079c752842562e01743421ad942f5257f","probe_id":"validation_trace","reason_code":"none","run_id":"agent_stage8_1_02_procedural","schema_version":"1.0","status":"ok"}]
