{"actual_cost":{"bytes_read":727,"cpu_ms":0.15885,"latency_ms":0.15717},"channel":"independent_verifier","coverage_receipts":[],"epoch_id":"epoch.stage2.denied_readback","facts":[{"fact_key":"trace.validation_before_update","source_ref":"trace:traces/epoch.stage2.denied_readback.json","value":true}],"observation_id":"obs.run.stage2.denied_readback.validation_trace.4","observed_at":"2026-10-24T16:27:43.255356Z","payload_sha256":"0f8e56987bc8d0bfc2f5682589275d6d9e73d7172bf1e3fdbe1d69d089bd6463","probe_id":"validation_trace","reason_code":"none","run_id":"run.stage2.denied_readback","schema_version":"1.0","status":"ok"}
