{"actual_cost":{"bytes_read":687,"cpu_ms":0.17893,"latency_ms":0.17746},"channel":"independent_verifier","coverage_receipts":[],"epoch_id":"epoch.stage2.clean","facts":[{"fact_key":"trace.validation_before_update","source_ref":"trace:traces/epoch.stage2.clean.json","value":true}],"observation_id":"obs.run.stage2.clean.validation_trace.4","observed_at":"2026-10-24T16:39:08.464123Z","payload_sha256":"5949084f36b1aa4de42364136c8b578a5768fe7d8e549923644c8afdf0cc6d2e","probe_id":"validation_trace","reason_code":"none","run_id":"run.stage2.clean","schema_version":"1.0","status":"ok"}
