{"actual_cost":{"bytes_read":1368,"cpu_ms":0.13569,"latency_ms":0.13422},"channel":"independent_verifier","coverage_receipts":[{"completeness":"complete","consistent_epoch":true,"independent_source":true,"method":"snapshot_pair","snapshot_after_ref":"snapshots/epoch.stage2.missing_validation.after.json","snapshot_before_ref":"snapshots/epoch.stage2.missing_validation.before.json","surface_id":"filesystem.reports"},{"completeness":"complete","consistent_epoch":true,"independent_source":true,"method":"snapshot_pair","snapshot_after_ref":"snapshots/epoch.stage2.missing_validation.after.json","snapshot_before_ref":"snapshots/epoch.stage2.missing_validation.before.json","surface_id":"sqlite.students"}],"epoch_id":"epoch.stage2.missing_validation","facts":[{"fact_key":"mutation.out_of_frame_count","source_ref":"snapshot-pair:snapshots/epoch.stage2.missing_validation.before.json|snapshots/epoch.stage2.missing_validation.after.json","value":0}],"observation_id":"obs.run.stage2.missing_validation.full_frame_diff.3","observed_at":"2026-10-24T16:39:08.599615Z","payload_sha256":"020805d451ec702a894144dd6b769dbbd73ccf5c569f16f6c1f7b85492f985f2","probe_id":"full_frame_diff","reason_code":"none","run_id":"run.stage2.missing_validation","schema_version":"1.0","status":"ok"}
