{"actual_cost":{"bytes_read":524,"cpu_ms":0.19338,"latency_ms":0.19145},"channel":"independent_verifier","coverage_receipts":[],"epoch_id":"epoch.stage2.missing_report","facts":[{"fact_key":"trace.validation_before_update","source_ref":"trace:traces/epoch.stage2.missing_report.json","value":true}],"observation_id":"obs.run.stage2.missing_report.validation_trace.4","observed_at":"2026-10-24T16:39:08.491373Z","payload_sha256":"f742bf6298098f262620a3843610fe72359dd92da16b4460fab6e973dd7957eb","probe_id":"validation_trace","reason_code":"none","run_id":"run.stage2.missing_report","schema_version":"1.0","status":"ok"}
