[{"actual_cost":{"bytes_read":0,"cpu_ms":0.0,"latency_ms":0.0},"channel":"independent_verifier","coverage_receipts":[],"epoch_id":"epoch.cancel_and_void_payment.denied_readback","facts":[],"observation_id":"obs.study.cancel_and_void_payment.denied_readback.outcome_readback","observed_at":"2026-10-25T10:56:25.227484Z","payload_sha256":"e9712d7ec579d4f1ada89ecabe66519c32dde72f5b53179bb71c89eeb891c29c","probe_id":"outcome_readback","reason_code":"permission_denied","run_id":"study.cancel_and_void_payment.denied_readback","schema_version":"1.0","status":"unavailable"},{"actual_cost":{"bytes_read":0,"cpu_ms":0.0,"latency_ms":0.0},"channel":"independent_verifier","coverage_receipts":[],"epoch_id":"epoch.cancel_and_void_payment.denied_readback","facts":[],"observation_id":"obs.study.cancel_and_void_payment.denied_readback.closed_world_diff","observed_at":"2026-10-25T10:56:25.227513Z","payload_sha256":"5bb6b71c9fc8d593f08018c5f9792afc342dd19a5a0a95da5265d5e882da7e35","probe_id":"closed_world_diff","reason_code":"permission_denied","run_id":"study.cancel_and_void_payment.denied_readback","schema_version":"1.0","status":"unavailable"}]
