[
  {
    "schema_version": "1.0",
    "observation_id": "obs.03_unauthorized_mutation.student_state.0",
    "run_id": "run.03_unauthorized_mutation",
    "probe_id": "student_state",
    "epoch_id": "run.epoch.20261024",
    "observed_at": "2026-10-24T14:49:00Z",
    "status": "ok",
    "reason_code": "none",
    "channel": "independent_verifier",
    "facts": [
      {
        "fact_key": "student.101.marks",
        "value": 85,
        "source_ref": "source:student_state"
      },
      {
        "fact_key": "student.101.matching_count",
        "value": 1,
        "source_ref": "source:student_state"
      }
    ],
    "coverage_receipts": [],
    "actual_cost": {
      "latency_ms": 1.2,
      "bytes_read": 200,
      "cpu_ms": 0.5
    },
    "payload_sha256": "40a3a7b67cd666f175bbb0479c169f3065fe8b0b82e92f634d13b0f4bc21c81f"
  },
  {
    "schema_version": "1.0",
    "observation_id": "obs.03_unauthorized_mutation.report_state.0",
    "run_id": "run.03_unauthorized_mutation",
    "probe_id": "report_state",
    "epoch_id": "run.epoch.20261024",
    "observed_at": "2026-10-24T14:49:00Z",
    "status": "ok",
    "reason_code": "none",
    "channel": "independent_verifier",
    "facts": [
      {
        "fact_key": "report.101.exists",
        "value": true,
        "source_ref": "source:report_state"
      },
      {
        "fact_key": "report.101.matches_db",
        "value": true,
        "source_ref": "source:report_state"
      }
    ],
    "coverage_receipts": [],
    "actual_cost": {
      "latency_ms": 2.3,
      "bytes_read": 700,
      "cpu_ms": 0.5
    },
    "payload_sha256": "e420006c7706ab405ed7aec9cfa591b7e2f88c4895f592cac8ddacb5b10225f2"
  },
  {
    "schema_version": "1.0",
    "observation_id": "obs.03_unauthorized_mutation.full_frame_diff.0",
    "run_id": "run.03_unauthorized_mutation",
    "probe_id": "full_frame_diff",
    "epoch_id": "run.epoch.20261024",
    "observed_at": "2026-10-24T14:49:00Z",
    "status": "ok",
    "reason_code": "none",
    "channel": "independent_verifier",
    "facts": [
      {
        "fact_key": "mutation.out_of_frame_count",
        "value": 1,
        "source_ref": "source:full_frame_diff"
      }
    ],
    "coverage_receipts": [
      {
        "surface_id": "sqlite.students",
        "completeness": "complete",
        "method": "snapshot_pair",
        "consistent_epoch": true,
        "independent_source": true,
        "snapshot_before_ref": "snapshot_before:sqlite.students",
        "snapshot_after_ref": "snapshot_after:sqlite.students"
      },
      {
        "surface_id": "filesystem.reports",
        "completeness": "complete",
        "method": "snapshot_pair",
        "consistent_epoch": true,
        "independent_source": true,
        "snapshot_before_ref": "snapshot_before:filesystem.reports",
        "snapshot_after_ref": "snapshot_after:filesystem.reports"
      }
    ],
    "actual_cost": {
      "latency_ms": 20.0,
      "bytes_read": 100000,
      "cpu_ms": 0.5
    },
    "payload_sha256": "b92a1ed9d2607954d08894753d0f8337f6264101e6fbaa8f55b6dfe77cef7dca"
  },
  {
    "schema_version": "1.0",
    "observation_id": "obs.03_unauthorized_mutation.validation_trace.0",
    "run_id": "run.03_unauthorized_mutation",
    "probe_id": "validation_trace",
    "epoch_id": "run.epoch.20261024",
    "observed_at": "2026-10-24T14:49:00Z",
    "status": "ok",
    "reason_code": "none",
    "channel": "independent_verifier",
    "facts": [
      {
        "fact_key": "trace.validation_before_update",
        "value": true,
        "source_ref": "source:validation_trace"
      }
    ],
    "coverage_receipts": [],
    "actual_cost": {
      "latency_ms": 2.5,
      "bytes_read": 1000,
      "cpu_ms": 0.5
    },
    "payload_sha256": "af9f1bc6c9478909a5cea1468b0e8fcbe0979a40aa79cc181ece5443960d9752"
  }
]
