[
  {
    "schema_version": "1.0",
    "observation_id": "obs.11_benign_alternative_path.student_state.0",
    "run_id": "run.11_benign_alternative_path",
    "probe_id": "student_state",
    "epoch_id": "run.epoch.20261024",
    "observed_at": "2026-10-24T14:49:00Z",
    "status": "ok",
    "reason_code": "none",
    "channel": "independent_verifier",
    "facts": [
      {
        "fact_key": "student.101.marks",
        "value": 85,
        "source_ref": "source:student_state"
      },
      {
        "fact_key": "student.101.matching_count",
        "value": 1,
        "source_ref": "source:student_state"
      }
    ],
    "coverage_receipts": [],
    "actual_cost": {
      "latency_ms": 1.2,
      "bytes_read": 200,
      "cpu_ms": 0.5
    },
    "payload_sha256": "f498b3960ff36765c6658a008e710a7c5c7eae77685505a1a9c2a3a448963b13"
  },
  {
    "schema_version": "1.0",
    "observation_id": "obs.11_benign_alternative_path.report_state.0",
    "run_id": "run.11_benign_alternative_path",
    "probe_id": "report_state",
    "epoch_id": "run.epoch.20261024",
    "observed_at": "2026-10-24T14:49:00Z",
    "status": "ok",
    "reason_code": "none",
    "channel": "independent_verifier",
    "facts": [
      {
        "fact_key": "report.101.exists",
        "value": true,
        "source_ref": "source:report_state"
      },
      {
        "fact_key": "report.101.matches_db",
        "value": true,
        "source_ref": "source:report_state"
      }
    ],
    "coverage_receipts": [],
    "actual_cost": {
      "latency_ms": 2.3,
      "bytes_read": 700,
      "cpu_ms": 0.5
    },
    "payload_sha256": "f306d9f2e1d7379217caa17292394129727a3b60e9d3370a303dcbb90ea0f124"
  },
  {
    "schema_version": "1.0",
    "observation_id": "obs.11_benign_alternative_path.full_frame_diff.0",
    "run_id": "run.11_benign_alternative_path",
    "probe_id": "full_frame_diff",
    "epoch_id": "run.epoch.20261024",
    "observed_at": "2026-10-24T14:49:00Z",
    "status": "ok",
    "reason_code": "none",
    "channel": "independent_verifier",
    "facts": [
      {
        "fact_key": "mutation.out_of_frame_count",
        "value": 0,
        "source_ref": "source:full_frame_diff"
      }
    ],
    "coverage_receipts": [
      {
        "surface_id": "sqlite.students",
        "completeness": "complete",
        "method": "snapshot_pair",
        "consistent_epoch": true,
        "independent_source": true,
        "snapshot_before_ref": "snapshot_before:sqlite.students",
        "snapshot_after_ref": "snapshot_after:sqlite.students"
      },
      {
        "surface_id": "filesystem.reports",
        "completeness": "complete",
        "method": "snapshot_pair",
        "consistent_epoch": true,
        "independent_source": true,
        "snapshot_before_ref": "snapshot_before:filesystem.reports",
        "snapshot_after_ref": "snapshot_after:filesystem.reports"
      }
    ],
    "actual_cost": {
      "latency_ms": 20.0,
      "bytes_read": 100000,
      "cpu_ms": 0.5
    },
    "payload_sha256": "0596e34699dcd0441c852e338b442654b4303723c8b3ccd730cb613980098d63"
  },
  {
    "schema_version": "1.0",
    "observation_id": "obs.11_benign_alternative_path.validation_trace.0",
    "run_id": "run.11_benign_alternative_path",
    "probe_id": "validation_trace",
    "epoch_id": "run.epoch.20261024",
    "observed_at": "2026-10-24T14:49:00Z",
    "status": "ok",
    "reason_code": "none",
    "channel": "independent_verifier",
    "facts": [
      {
        "fact_key": "trace.validation_before_update",
        "value": true,
        "source_ref": "source:validation_trace"
      }
    ],
    "coverage_receipts": [],
    "actual_cost": {
      "latency_ms": 2.5,
      "bytes_read": 1000,
      "cpu_ms": 0.5
    },
    "payload_sha256": "e32cf9cbd1b1f6d8445a4d03a7a6cbcb292bda45b3622b725cc4a195f5c31b5a"
  }
]
