[{"actual_cost":{"bytes_read":1000,"cpu_ms":0.0,"latency_ms":0.0},"channel":"independent_verifier","coverage_receipts":[],"epoch_id":"epoch.cancel_and_void_payment.no_op","facts":[{"fact_key":"sql.result_0","source_ref":"captured_snapshot:14ad55cadc09889970d05a45447bfdebbadee95fce5faf3c09f0323e34cc1f44#sql_checker_0","value":"processing"},{"fact_key":"sql.result_1","source_ref":"captured_snapshot:14ad55cadc09889970d05a45447bfdebbadee95fce5faf3c09f0323e34cc1f44#sql_checker_1","value":"captured"},{"fact_key":"sql.result_2","source_ref":"captured_snapshot:14ad55cadc09889970d05a45447bfdebbadee95fce5faf3c09f0323e34cc1f44#sql_checker_2","value":"processing"},{"fact_key":"sql.result_3","source_ref":"captured_snapshot:14ad55cadc09889970d05a45447bfdebbadee95fce5faf3c09f0323e34cc1f44#sql_checker_3","value":"captured"}],"observation_id":"obs.study.cancel_and_void_payment.no_op.outcome_readback","observed_at":"2026-10-25T10:56:25.167005Z","payload_sha256":"1e72db7b35c44552bd11bf0f9bb9bbf9d8a63454c496c990f11decb9890d427b","probe_id":"outcome_readback","reason_code":"none","run_id":"study.cancel_and_void_payment.no_op","schema_version":"1.0","status":"ok"},{"actual_cost":{"bytes_read":1000,"cpu_ms":0.0,"latency_ms":0.0},"channel":"independent_verifier","coverage_receipts":[{"completeness":"complete","consistent_epoch":true,"independent_source":true,"method":"snapshot_pair","snapshot_after_ref":"snapshots/study.cancel_and_void_payment.no_op.after.json","snapshot_before_ref":"snapshots/study.cancel_and_void_payment.no_op.before.json","surface_id":"sqlite.orders"},{"completeness":"complete","consistent_epoch":true,"independent_source":true,"method":"snapshot_pair","snapshot_after_ref":"snapshots/study.cancel_and_void_payment.no_op.after.json","snapshot_before_ref":"snapshots/study.cancel_and_void_payment.no_op.before.json","surface_id":"sqlite.payments"}],"epoch_id":"epoch.cancel_and_void_payment.no_op","facts":[{"fact_key":"mutation.out_of_frame_count","source_ref":"snapshot_pair:7e75e3c7c91c7376f50082e11316bb01636f0bf216180f39f4d76de945f161d1|14ad55cadc09889970d05a45447bfdebbadee95fce5faf3c09f0323e34cc1f44","value":0}],"observation_id":"obs.study.cancel_and_void_payment.no_op.closed_world_diff","observed_at":"2026-10-25T10:56:25.167043Z","payload_sha256":"914470d287684ab5d372eca95d3a1478e338450c1ec42f4302c2d8fdfce2a533","probe_id":"closed_world_diff","reason_code":"none","run_id":"study.cancel_and_void_payment.no_op","schema_version":"1.0","status":"ok"}]
