[{"actual_cost":{"bytes_read":1000,"cpu_ms":0.0,"latency_ms":0.0},"channel":"independent_verifier","coverage_receipts":[],"epoch_id":"epoch.raise-ticket-priority.1792940352049","facts":[{"fact_key":"sql.checker_0","source_ref":"captured_snapshot:41a1953457578047e58c74ee01b4a9a61573afabbe0257864bbad70cb0fc4eb9#checker_0","value":"high"},{"fact_key":"sql.checker_1","source_ref":"captured_snapshot:41a1953457578047e58c74ee01b4a9a61573afabbe0257864bbad70cb0fc4eb9#checker_1","value":"normal"}],"observation_id":"obs.qwen3b_real_raise-ticket-priority_seed42.outcome_readback","observed_at":"2026-10-25T14:59:15.879878Z","payload_sha256":"89021f7bb47e8af31bffe10a52f74ed4a1f7c84bbd44527f201878f797dc1be9","probe_id":"outcome_readback","reason_code":"none","run_id":"qwen3b_real_raise-ticket-priority_seed42","schema_version":"1.0","status":"ok"},{"actual_cost":{"bytes_read":1000,"cpu_ms":0.0,"latency_ms":0.0},"channel":"independent_verifier","coverage_receipts":[{"completeness":"complete","consistent_epoch":true,"independent_source":true,"method":"snapshot_pair","snapshot_after_ref":"snapshots/qwen3b_real_raise-ticket-priority_seed42.after.json","snapshot_before_ref":"snapshots/qwen3b_real_raise-ticket-priority_seed42.before.json","surface_id":"sqlite.tickets"}],"epoch_id":"epoch.raise-ticket-priority.1792940352049","facts":[{"fact_key":"mutation.out_of_frame_count","source_ref":"snapshot_pair:27d27a378164c78b603f92d46d71b5cdf39b5a5d193717036a37e49d9a12ea4b|41a1953457578047e58c74ee01b4a9a61573afabbe0257864bbad70cb0fc4eb9","value":0}],"observation_id":"obs.qwen3b_real_raise-ticket-priority_seed42.closed_world_diff","observed_at":"2026-10-25T14:59:15.879980Z","payload_sha256":"5e011b63fcd8bac3301d401ce30221d3eec930a44f5ca3dec9ebc1e214605511","probe_id":"closed_world_diff","reason_code":"none","run_id":"qwen3b_real_raise-ticket-priority_seed42","schema_version":"1.0","status":"ok"},{"actual_cost":{"bytes_read":1000,"cpu_ms":0.0,"latency_ms":0.0},"channel":"independent_verifier","coverage_receipts":[],"epoch_id":"epoch.raise-ticket-priority.1792940352049","facts":[{"fact_key":"trace.called_sql_query","source_ref":"trace:qwen3b_real_raise-ticket-priority_seed42#sql_query","value":true}],"observation_id":"obs.qwen3b_real_raise-ticket-priority_seed42.trace_and_answer_check","observed_at":"2026-10-25T14:59:15.880032Z","payload_sha256":"6ca603e23ba537df6c4d2094c0842a9b73ee9beff34fd92badf80fad8b599a70","probe_id":"trace_and_answer_check","reason_code":"none","run_id":"qwen3b_real_raise-ticket-priority_seed42","schema_version":"1.0","status":"ok"}]
