{"actual_cost":{"bytes_read":23,"cpu_ms":0.15746,"latency_ms":0.15578},"channel":"independent_verifier","coverage_receipts":[],"epoch_id":"epoch.stage2.silent_noop","facts":[{"fact_key":"report.101.exists","source_ref":"captured:snapshots/epoch.stage2.silent_noop.after.json#files/reports/student_101.md","value":true},{"fact_key":"report.101.matches_db","source_ref":"captured:snapshots/epoch.stage2.silent_noop.after.json#files/reports/student_101.md","value":false}],"observation_id":"obs.run.stage2.silent_noop.report_state.2","observed_at":"2026-10-24T17:10:55.403691Z","payload_sha256":"9d5d9adeb95406804ce1139d7442f6875e0fc54e1cfc4df11db5baad4496aea5","probe_id":"report_state","reason_code":"none","run_id":"run.stage2.silent_noop","schema_version":"1.0","status":"ok"}
