{"actual_cost":{"bytes_read":108,"cpu_ms":0.03949,"latency_ms":0.03827},"channel":"independent_verifier","coverage_receipts":[],"epoch_id":"epoch.stage2.missing_report","facts":[{"fact_key":"student.101.marks","source_ref":"captured:snapshots/epoch.stage2.missing_report.after.json#sqlite.students","value":85},{"fact_key":"student.101.matching_count","source_ref":"captured:snapshots/epoch.stage2.missing_report.after.json#sqlite.students","value":1}],"observation_id":"obs.run.stage2.missing_report.student_state.1","observed_at":"2026-10-24T17:10:55.288763Z","payload_sha256":"b1fdabf8d0818b65170e09dc05d3b1cb445a79f73091e443c5581aa169fa06dd","probe_id":"student_state","reason_code":"none","run_id":"run.stage2.missing_report","schema_version":"1.0","status":"ok"}
