[{"actual_cost":{"bytes_read":1000,"cpu_ms":0.0,"latency_ms":0.0},"channel":"independent_verifier","coverage_receipts":[],"epoch_id":"epoch.refund_and_restock.no_op","facts":[{"fact_key":"sql.result_0","source_ref":"captured_snapshot:ebb159d8706103a5db87e14bcbcf688668010fd73f09a205d51c79fe279dbe37#sql_checker_0","value":"paid"},{"fact_key":"sql.result_1","source_ref":"captured_snapshot:ebb159d8706103a5db87e14bcbcf688668010fd73f09a205d51c79fe279dbe37#sql_checker_1","value":"paid"},{"fact_key":"sql.result_2","source_ref":"captured_snapshot:ebb159d8706103a5db87e14bcbcf688668010fd73f09a205d51c79fe279dbe37#sql_checker_2","value":10},{"fact_key":"sql.result_3","source_ref":"captured_snapshot:ebb159d8706103a5db87e14bcbcf688668010fd73f09a205d51c79fe279dbe37#sql_checker_3","value":4}],"observation_id":"obs.study.refund_and_restock.no_op.outcome_readback","observed_at":"2026-10-25T10:56:25.067419Z","payload_sha256":"13da6ee7c42c438e6e57b0d2b7bc396bdf6f7e7923e23bf2ed7caa94bb3c757a","probe_id":"outcome_readback","reason_code":"none","run_id":"study.refund_and_restock.no_op","schema_version":"1.0","status":"ok"},{"actual_cost":{"bytes_read":1000,"cpu_ms":0.0,"latency_ms":0.0},"channel":"independent_verifier","coverage_receipts":[{"completeness":"complete","consistent_epoch":true,"independent_source":true,"method":"snapshot_pair","snapshot_after_ref":"snapshots/study.refund_and_restock.no_op.after.json","snapshot_before_ref":"snapshots/study.refund_and_restock.no_op.before.json","surface_id":"sqlite.inventory"},{"completeness":"complete","consistent_epoch":true,"independent_source":true,"method":"snapshot_pair","snapshot_after_ref":"snapshots/study.refund_and_restock.no_op.after.json","snapshot_before_ref":"snapshots/study.refund_and_restock.no_op.before.json","surface_id":"sqlite.order_items"},{"completeness":"complete","consistent_epoch":true,"independent_source":true,"method":"snapshot_pair","snapshot_after_ref":"snapshots/study.refund_and_restock.no_op.after.json","snapshot_before_ref":"snapshots/study.refund_and_restock.no_op.before.json","surface_id":"sqlite.orders"}],"epoch_id":"epoch.refund_and_restock.no_op","facts":[{"fact_key":"mutation.out_of_frame_count","source_ref":"snapshot_pair:01ccfa322efe93b5e3a8fb3d1fb419e4ad342470af485e66e8b80e66933ed16e|ebb159d8706103a5db87e14bcbcf688668010fd73f09a205d51c79fe279dbe37","value":0}],"observation_id":"obs.study.refund_and_restock.no_op.closed_world_diff","observed_at":"2026-10-25T10:56:25.067456Z","payload_sha256":"50037364625e7865a3f8b7f2bb9bdaf683c664e8200bcd47464e63dd5fa4d7e5","probe_id":"closed_world_diff","reason_code":"none","run_id":"study.refund_and_restock.no_op","schema_version":"1.0","status":"ok"}]
