{"actual_cost":{"bytes_read":1342,"cpu_ms":0.14901,"latency_ms":0.14735},"channel":"independent_verifier","coverage_receipts":[{"completeness":"complete","consistent_epoch":true,"independent_source":true,"method":"snapshot_pair","snapshot_after_ref":"snapshots/epoch.stage2.clean.after.json","snapshot_before_ref":"snapshots/epoch.stage2.clean.before.json","surface_id":"filesystem.reports"},{"completeness":"complete","consistent_epoch":true,"independent_source":true,"method":"snapshot_pair","snapshot_after_ref":"snapshots/epoch.stage2.clean.after.json","snapshot_before_ref":"snapshots/epoch.stage2.clean.before.json","surface_id":"sqlite.students"}],"epoch_id":"epoch.stage2.clean","facts":[{"fact_key":"mutation.out_of_frame_count","source_ref":"snapshot-pair:snapshots/epoch.stage2.clean.before.json|snapshots/epoch.stage2.clean.after.json","value":0}],"observation_id":"obs.run.stage2.clean.full_frame_diff.3","observed_at":"2026-10-24T16:39:08.462890Z","payload_sha256":"bff96ce738222d3992c3db07e7334c1b653476c7470084e50997c48aba0d4e5a","probe_id":"full_frame_diff","reason_code":"none","run_id":"run.stage2.clean","schema_version":"1.0","status":"ok"}
