[{"actual_cost":{"bytes_read":0,"cpu_ms":0.0,"latency_ms":0.0},"channel":"independent_verifier","coverage_receipts":[],"epoch_id":"epoch.refund_and_restock.denied_readback","facts":[],"observation_id":"obs.study.refund_and_restock.denied_readback.outcome_readback","observed_at":"2026-10-25T10:56:25.138464Z","payload_sha256":"9320305127f05031003e938fa1457b8f25ab5c41aff9aa07747d09b9fef871ea","probe_id":"outcome_readback","reason_code":"permission_denied","run_id":"study.refund_and_restock.denied_readback","schema_version":"1.0","status":"unavailable"},{"actual_cost":{"bytes_read":0,"cpu_ms":0.0,"latency_ms":0.0},"channel":"independent_verifier","coverage_receipts":[],"epoch_id":"epoch.refund_and_restock.denied_readback","facts":[],"observation_id":"obs.study.refund_and_restock.denied_readback.closed_world_diff","observed_at":"2026-10-25T10:56:25.138494Z","payload_sha256":"4ff370a4f1bfdfcd46bfb1811bad4c115e9b952f98d4807353f1acf33e45534c","probe_id":"closed_world_diff","reason_code":"permission_denied","run_id":"study.refund_and_restock.denied_readback","schema_version":"1.0","status":"unavailable"}]
