{"actual_cost":{"bytes_read":23,"cpu_ms":0.14749,"latency_ms":0.14558},"channel":"independent_verifier","coverage_receipts":[],"epoch_id":"epoch.stage2.missing_validation","facts":[{"fact_key":"report.101.exists","source_ref":"captured:snapshots/epoch.stage2.missing_validation.after.json#files/reports/student_101.md","value":true},{"fact_key":"report.101.matches_db","source_ref":"captured:snapshots/epoch.stage2.missing_validation.after.json#files/reports/student_101.md","value":true}],"observation_id":"obs.run.stage2.missing_validation.report_state.2","observed_at":"2026-10-24T16:53:40.850895Z","payload_sha256":"14c20c64e1b8e6fd6e497f576824017e67c9db78405fc28525521de0364d4675","probe_id":"report_state","reason_code":"none","run_id":"run.stage2.missing_validation","schema_version":"1.0","status":"ok"}
