{"actual_cost":{"bytes_read":23,"cpu_ms":0.15416,"latency_ms":0.15207},"channel":"independent_verifier","coverage_receipts":[],"epoch_id":"epoch.stage2.denied_readback","facts":[{"fact_key":"report.101.exists","source_ref":"captured:snapshots/epoch.stage2.denied_readback.after.json#files/reports/student_101.md","value":true},{"fact_key":"report.101.matches_db","source_ref":"captured:snapshots/epoch.stage2.denied_readback.after.json#files/reports/student_101.md","value":true}],"observation_id":"obs.run.stage2.denied_readback.report_state.2","observed_at":"2026-10-24T16:27:43.252963Z","payload_sha256":"97d07b5583ff22e0ab531bece4335c5d29bdf06b7e1e64d081abe022153fe6f0","probe_id":"report_state","reason_code":"none","run_id":"run.stage2.denied_readback","schema_version":"1.0","status":"ok"}
