{"actual_cost":{"bytes_read":108,"cpu_ms":0.04613,"latency_ms":0.04634},"channel":"independent_verifier","coverage_receipts":[],"epoch_id":"epoch.stage2.clean","facts":[{"fact_key":"student.101.marks","source_ref":"captured:snapshots/epoch.stage2.clean.after.json#sqlite.students","value":85},{"fact_key":"student.101.matching_count","source_ref":"captured:snapshots/epoch.stage2.clean.after.json#sqlite.students","value":1}],"observation_id":"obs.run.stage2.clean.student_state.1","observed_at":"2026-10-24T16:39:08.460479Z","payload_sha256":"c2e141fca8df001623553bf11a7d3b47f3d6d6f951b2039f756153a23475dc20","probe_id":"student_state","reason_code":"none","run_id":"run.stage2.clean","schema_version":"1.0","status":"ok"}
