{"actual_cost":{"bytes_read":0,"cpu_ms":0.02246,"latency_ms":0.021},"channel":"independent_verifier","coverage_receipts":[],"epoch_id":"epoch.stage2.missing_report","facts":[{"fact_key":"report.101.exists","source_ref":"captured:snapshots/epoch.stage2.missing_report.after.json#files/reports/student_101.md","value":false},{"fact_key":"report.101.matches_db","source_ref":"captured:snapshots/epoch.stage2.missing_report.after.json#files/reports/student_101.md","value":false}],"observation_id":"obs.run.stage2.missing_report.report_state.2","observed_at":"2026-10-24T17:10:55.289703Z","payload_sha256":"fda460d7f17d10499b58f6650573d8bb473182a56e7c71372c66ca78fef19367","probe_id":"report_state","reason_code":"none","run_id":"run.stage2.missing_report","schema_version":"1.0","status":"ok"}
