{"actual_cost":{"bytes_read":108,"cpu_ms":0.1385,"latency_ms":0.13562},"channel":"independent_verifier","coverage_receipts":[],"epoch_id":"epoch.stage2.silent_noop","facts":[{"fact_key":"student.101.marks","source_ref":"captured:snapshots/epoch.stage2.silent_noop.after.json#sqlite.students","value":70},{"fact_key":"student.101.matching_count","source_ref":"captured:snapshots/epoch.stage2.silent_noop.after.json#sqlite.students","value":1}],"observation_id":"obs.run.stage2.silent_noop.student_state.1","observed_at":"2026-10-24T16:02:29.190744Z","payload_sha256":"e2dec35057d10cb812f9a44b2c885f8f1b64e2019fe6993162b308cd291b8ca6","probe_id":"student_state","reason_code":"none","run_id":"run.stage2.silent_noop","schema_version":"1.0","status":"ok"}
